{"schema":"swarm.live.v1","correlation_id":"38a71d68-5a6c-4dfd-b5b2-129fbb9d5c4b","seq":6,"updated_wall":1792386047.0889118,"swarm":{"state":"running","elapsed_s":19.371,"max_parallel":4,"effective_parallel":4,"running":1,"queued":1,"waiting":10,"completed":1,"failed":0,"cancelled":0,"timed_out":0,"stalled":0,"degraded":null},"runs":[{"run_id":"T38a7-arch.a1","task_id":"T38a7-arch","agent":"A03","state":"running","attempt":1,"elapsed_s":0.284,"state_elapsed_s":0.152,"since_activity_s":0.152,"stalled":false,"activity":null,"tool_calls":0,"last_tool":null,"parent":null,"handover_in":null,"handover_out":null,"error":null},{"run_id":"T38a7-data.a1","task_id":"T38a7-data","agent":"A07","state":"waiting","attempt":1,"elapsed_s":19.37,"state_elapsed_s":19.37,"since_activity_s":null,"stalled":false,"activity":null,"tool_calls":0,"last_tool":null,"parent":null,"handover_in":null,"handover_out":null,"error":null},{"run_id":"T38a7-fe.a1","task_id":"T38a7-fe","agent":"A06","state":"waiting","attempt":1,"elapsed_s":19.37,"state_elapsed_s":19.37,"since_activity_s":null,"stalled":false,"activity":null,"tool_calls":0,"last_tool":null,"parent":null,"handover_in":null,"handover_out":null,"error":null},{"run_id":"T38a7-be.a1","task_id":"T38a7-be","agent":"A05","state":"waiting","attempt":1,"elapsed_s":19.37,"state_elapsed_s":19.37,"since_activity_s":null,"stalled":false,"activity":null,"tool_calls":0,"last_tool":null,"parent":null,"handover_in":null,"handover_out":null,"error":null},{"run_id":"T38a7-qa.a1","task_id":"T38a7-qa","agent":"A08","state":"waiting","attempt":1,"elapsed_s":19.37,"state_elapsed_s":19.37,"since_activity_s":null,"stalled":false,"activity":null,"tool_calls":0,"last_tool":null,"parent":null,"handover_in":null,"handover_out":null,"error":null},{"run_id":"T38a7-rev.a1","task_id":"T38a7-rev","agent":"A09","state":"waiting","attempt":1,"elapsed_s":19.369,"state_elapsed_s":19.369,"since_activity_s":null,"stalled":false,"activity":null,"tool_calls":0,"last_tool":null,"parent":null,"handover_in":null,"handover_out":null,"error":null},{"run_id":"T38a7-sec.a1","task_id":"T38a7-sec","agent":"A10","state":"waiting","attempt":1,"elapsed_s":19.369,"state_elapsed_s":19.369,"since_activity_s":null,"stalled":false,"activity":null,"tool_calls":0,"last_tool":null,"parent":null,"handover_in":null,"handover_out":null,"error":null},{"run_id":"T38a7-build.a1","task_id":"T38a7-build","agent":"A11","state":"waiting","attempt":1,"elapsed_s":19.369,"state_elapsed_s":19.369,"since_activity_s":null,"stalled":false,"activity":null,"tool_calls":0,"last_tool":null,"parent":null,"handover_in":null,"handover_out":null,"error":null},{"run_id":"T38a7-rel.a1","task_id":"T38a7-rel","agent":"A12","state":"waiting","attempt":1,"elapsed_s":19.369,"state_elapsed_s":19.369,"since_activity_s":null,"stalled":false,"activity":null,"tool_calls":0,"last_tool":null,"parent":null,"handover_in":null,"handover_out":null,"error":null},{"run_id":"T38a7-obs.a1","task_id":"T38a7-obs","agent":"A13","state":"waiting","attempt":1,"elapsed_s":19.368,"state_elapsed_s":19.368,"since_activity_s":null,"stalled":false,"activity":null,"tool_calls":0,"last_tool":null,"parent":null,"handover_in":null,"handover_out":null,"error":null},{"run_id":"T38a7-docs.a1","task_id":"T38a7-docs","agent":"A15","state":"waiting","attempt":1,"elapsed_s":19.368,"state_elapsed_s":19.368,"since_activity_s":null,"stalled":false,"activity":null,"tool_calls":0,"last_tool":null,"parent":null,"handover_in":null,"handover_out":null,"error":null},{"run_id":"T38a7-ux.a1","task_id":"T38a7-ux","agent":"A04","state":"queued","attempt":1,"elapsed_s":19.371,"state_elapsed_s":19.37,"since_activity_s":null,"stalled":false,"activity":null,"tool_calls":0,"last_tool":null,"parent":null,"handover_in":null,"handover_out":null,"error":null},{"run_id":"T38a7-req.a1","task_id":"T38a7-req","agent":"A02","state":"completed","attempt":1,"elapsed_s":10.008,"state_elapsed_s":0.0,"since_activity_s":null,"stalled":false,"activity":null,"tool_calls":0,"last_tool":null,"parent":null,"handover_in":null,"handover_out":null,"error":null}],"producer":"derived","pid":1805366}