{
  "correlation_id": "e9c741e9-847e-48c0-8b2e-d221b4031141",
  "pid": 1554110,
  "producer": "scheduler",
  "producer_updated": 1792381410.5626376,
  "runs": [
    {
      "activity": null,
      "agent": "a14-maintenance",
      "attempt": 1,
      "elapsed_s": 0.062,
      "error": "E-CONTRACT: agent session reported error (rc=1)",
      "handover_in": null,
      "handover_out": null,
      "last_tool": null,
      "parent": null,
      "run_id": "T-a14.a1",
      "since_activity_s": null,
      "stalled": false,
      "state": "failed",
      "state_elapsed_s": 0.0,
      "task_id": "T-a14",
      "tool_calls": 0
    },
    {
      "activity": null,
      "agent": "a15-docs",
      "attempt": 1,
      "elapsed_s": 1.104,
      "error": null,
      "handover_in": null,
      "handover_out": null,
      "last_tool": null,
      "parent": null,
      "run_id": "T-a15.a1",
      "since_activity_s": 1.073,
      "stalled": false,
      "state": "running",
      "state_elapsed_s": 1.104,
      "task_id": "T-a15",
      "tool_calls": 0
    },
    {
      "activity": null,
      "agent": "a05-backend",
      "attempt": 1,
      "elapsed_s": 0.355,
      "error": null,
      "handover_in": null,
      "handover_out": null,
      "last_tool": null,
      "parent": null,
      "run_id": "T-a05.a1",
      "since_activity_s": 0.322,
      "stalled": false,
      "state": "running",
      "state_elapsed_s": 0.356,
      "task_id": "T-a05",
      "tool_calls": 0
    },
    {
      "activity": null,
      "agent": "a06-frontend",
      "attempt": 1,
      "elapsed_s": 0.289,
      "error": null,
      "handover_in": null,
      "handover_out": null,
      "last_tool": null,
      "parent": null,
      "run_id": "T-a06.a1",
      "since_activity_s": 0.259,
      "stalled": false,
      "state": "running",
      "state_elapsed_s": 0.289,
      "task_id": "T-a06",
      "tool_calls": 0
    },
    {
      "activity": null,
      "agent": "a10-security",
      "attempt": 1,
      "elapsed_s": 1.962,
      "error": null,
      "handover_in": null,
      "handover_out": null,
      "last_tool": null,
      "parent": null,
      "run_id": "T-a10.a1",
      "since_activity_s": 1.962,
      "stalled": false,
      "state": "waiting",
      "state_elapsed_s": 1.962,
      "task_id": "T-a10",
      "tool_calls": 0
    },
    {
      "activity": null,
      "agent": "a09-reviewer",
      "attempt": 1,
      "elapsed_s": 1.967,
      "error": null,
      "handover_in": null,
      "handover_out": null,
      "last_tool": null,
      "parent": null,
      "run_id": "T-a09.a1",
      "since_activity_s": 1.967,
      "stalled": false,
      "state": "queued",
      "state_elapsed_s": 0.33,
      "task_id": "T-a09",
      "tool_calls": 0
    },
    {
      "activity": null,
      "agent": "a01-orchestrator",
      "attempt": 1,
      "elapsed_s": 0.415,
      "error": null,
      "handover_in": null,
      "handover_out": null,
      "last_tool": null,
      "parent": null,
      "run_id": "T-a01.a1",
      "since_activity_s": null,
      "stalled": false,
      "state": "completed",
      "state_elapsed_s": 0.0,
      "task_id": "T-a01",
      "tool_calls": 0
    },
    {
      "activity": null,
      "agent": "a02-requirements",
      "attempt": 1,
      "elapsed_s": 0.465,
      "error": null,
      "handover_in": null,
      "handover_out": null,
      "last_tool": null,
      "parent": null,
      "run_id": "T-a02.a1",
      "since_activity_s": null,
      "stalled": false,
      "state": "completed",
      "state_elapsed_s": 0.0,
      "task_id": "T-a02",
      "tool_calls": 0
    },
    {
      "activity": null,
      "agent": "a07-data",
      "attempt": 1,
      "elapsed_s": 0.448,
      "error": null,
      "handover_in": null,
      "handover_out": null,
      "last_tool": null,
      "parent": null,
      "run_id": "T-a07.a1",
      "since_activity_s": null,
      "stalled": false,
      "state": "completed",
      "state_elapsed_s": 0.0,
      "task_id": "T-a07",
      "tool_calls": 0
    },
    {
      "activity": null,
      "agent": "a11-devops",
      "attempt": 1,
      "elapsed_s": 0.424,
      "error": null,
      "handover_in": null,
      "handover_out": null,
      "last_tool": null,
      "parent": null,
      "run_id": "T-a11.a1",
      "since_activity_s": null,
      "stalled": false,
      "state": "completed",
      "state_elapsed_s": 0.0,
      "task_id": "T-a11",
      "tool_calls": 0
    },
    {
      "activity": null,
      "agent": "a12-release",
      "attempt": 1,
      "elapsed_s": 0.426,
      "error": null,
      "handover_in": null,
      "handover_out": null,
      "last_tool": null,
      "parent": null,
      "run_id": "T-a12.a1",
      "since_activity_s": null,
      "stalled": false,
      "state": "completed",
      "state_elapsed_s": 0.0,
      "task_id": "T-a12",
      "tool_calls": 0
    },
    {
      "activity": null,
      "agent": "a12-release",
      "attempt": 1,
      "elapsed_s": 0.43,
      "error": null,
      "handover_in": null,
      "handover_out": null,
      "last_tool": null,
      "parent": null,
      "run_id": "T-a12b.a1",
      "since_activity_s": null,
      "stalled": false,
      "state": "completed",
      "state_elapsed_s": 0.0,
      "task_id": "T-a12b",
      "tool_calls": 0
    },
    {
      "activity": null,
      "agent": "a12-release",
      "attempt": 1,
      "elapsed_s": 0.422,
      "error": null,
      "handover_in": null,
      "handover_out": null,
      "last_tool": null,
      "parent": null,
      "run_id": "T-a12c.a1",
      "since_activity_s": null,
      "stalled": false,
      "state": "completed",
      "state_elapsed_s": 0.0,
      "task_id": "T-a12c",
      "tool_calls": 0
    },
    {
      "activity": null,
      "agent": "a03-architect",
      "attempt": 1,
      "elapsed_s": 0.42,
      "error": null,
      "handover_in": null,
      "handover_out": null,
      "last_tool": null,
      "parent": null,
      "run_id": "T-a03.a1",
      "since_activity_s": null,
      "stalled": false,
      "state": "completed",
      "state_elapsed_s": 0.0,
      "task_id": "T-a03",
      "tool_calls": 0
    },
    {
      "activity": null,
      "agent": "a04-ux-designer",
      "attempt": 1,
      "elapsed_s": 0.43,
      "error": null,
      "handover_in": null,
      "handover_out": null,
      "last_tool": null,
      "parent": null,
      "run_id": "T-a04.a1",
      "since_activity_s": null,
      "stalled": false,
      "state": "completed",
      "state_elapsed_s": 0.0,
      "task_id": "T-a04",
      "tool_calls": 0
    },
    {
      "activity": null,
      "agent": "a08-qa",
      "attempt": 1,
      "elapsed_s": 0.413,
      "error": null,
      "handover_in": null,
      "handover_out": null,
      "last_tool": null,
      "parent": null,
      "run_id": "T-a08.a1",
      "since_activity_s": null,
      "stalled": false,
      "state": "completed",
      "state_elapsed_s": 0.0,
      "task_id": "T-a08",
      "tool_calls": 0
    },
    {
      "activity": null,
      "agent": "a13-observability",
      "attempt": 1,
      "elapsed_s": 0.422,
      "error": null,
      "handover_in": null,
      "handover_out": null,
      "last_tool": null,
      "parent": null,
      "run_id": "T-a13.a1",
      "since_activity_s": null,
      "stalled": false,
      "state": "completed",
      "state_elapsed_s": 0.0,
      "task_id": "T-a13",
      "tool_calls": 0
    }
  ],
  "schema": "swarm.live.v1",
  "seq": 49,
  "swarm": {
    "cancelled": 0,
    "completed": 11,
    "degraded": null,
    "effective_parallel": 4,
    "elapsed_s": 2.051,
    "failed": 1,
    "max_parallel": 4,
    "queued": 1,
    "running": 3,
    "stalled": 0,
    "state": "running",
    "timed_out": 0,
    "waiting": 1
  },
  "updated_wall": 1792381410.5626376
}
