{
  "schema": "swarm.live.v1",
  "correlation_id": "5d0c1f6e-2b1a-4c47-9a54-2f7f0b8d9e11",
  "seq": 14,
  "updated_wall": 1792390000.25,
  "swarm": {
    "state": "running",
    "elapsed_s": 61.4,
    "max_parallel": 4,
    "effective_parallel": 4,
    "running": 2,
    "queued": 0,
    "waiting": 0,
    "completed": 2,
    "failed": 1,
    "cancelled": 0,
    "timed_out": 0,
    "stalled": 0,
    "degraded": null
  },
  "producer": "scheduler",
  "pid": 1805367,
  "producer_updated": 1792390000.2,
  "runs": [
    {
      "run_id": "T-be.a1",
      "task_id": "T-be",
      "agent": "a05-backend",
      "state": "failed",
      "attempt": 1,
      "elapsed_s": 20.1,
      "state_elapsed_s": 0.0,
      "since_activity_s": null,
      "stalled": false,
      "activity": null,
      "tool_calls": 0,
      "last_tool": null,
      "parent": null,
      "handover_in": null,
      "handover_out": null,
      "error": "E-CONTRACT: agent session reported error (rc=1)"
    },
    {
      "run_id": "T-be.a2",
      "task_id": "T-be",
      "agent": "a05-backend",
      "state": "running",
      "attempt": 2,
      "elapsed_s": 9.8,
      "state_elapsed_s": 9.7,
      "since_activity_s": 1.2,
      "stalled": false,
      "activity": "edit swarm/x.py",
      "tool_calls": 4,
      "last_tool": null,
      "parent": null,
      "handover_in": null,
      "handover_out": null,
      "error": null
    },
    {
      "run_id": "T-fe.a1.r1",
      "task_id": "T-fe",
      "agent": "a06-frontend",
      "state": "running",
      "attempt": 1,
      "elapsed_s": 14.3,
      "state_elapsed_s": 14.2,
      "since_activity_s": 0.4,
      "stalled": false,
      "activity": "rework: fix contrast",
      "tool_calls": 7,
      "last_tool": null,
      "parent": null,
      "handover_in": null,
      "handover_out": null,
      "error": null
    },
    {
      "run_id": "T-docs.a1",
      "task_id": "T-docs",
      "agent": "a15-docs",
      "state": "completed",
      "attempt": 1,
      "elapsed_s": 30.0,
      "state_elapsed_s": 0.0,
      "since_activity_s": null,
      "stalled": false,
      "activity": null,
      "tool_calls": 0,
      "last_tool": null,
      "parent": null,
      "handover_in": null,
      "handover_out": null,
      "error": null
    },
    {
      "run_id": "T-fe.a1",
      "task_id": "T-fe",
      "agent": "a06-frontend",
      "state": "completed",
      "attempt": 1,
      "elapsed_s": 47.5,
      "state_elapsed_s": 0.0,
      "since_activity_s": null,
      "stalled": false,
      "activity": null,
      "tool_calls": 12,
      "last_tool": null,
      "parent": null,
      "handover_in": null,
      "handover_out": null,
      "error": null
    }
  ]
}
